"To investigate the efficacy of 6 weeks of daily low-dose oral prednisolone in improving pain , mobility , and systemic low-grade inflammation in the short term and whether the effect would be sustained at 12 weeks in older adults with moderate to severe knee osteoarthritis ( OA ) .There was a clinically relevant reduction in the intervention group compared to the placebo group for knee pain , physical function , PGA , and 6MWD at 6 weeks . The mean difference between treatment arms ( 95 % CI ) was 10.9 ( 4.8-18 .0 ) , p < 0.001 ; 9.5 ( 3.7-15 .4 ) , p < 0.05 ; 15.7 ( 5.3-26 .1 ) , p < 0.001 ; and 86.9 ( 29.8-144 .1 ) , p < 0.05 , respectively . Further , there was a clinically relevant reduction in the serum levels of IL-1 , IL-6 , TNF - , and hsCRP at 6 weeks in the intervention group when compared to the placebo group . These differences remained significant at 12 weeks . The Outcome Measures in Rheumatology Clinical Trials-Osteoarthritis Research Society International responder rate was 65 % in the intervention group and 34 % in the placebo group ( p < 0.05 ) .","Low-dose oral prednisolone had both a short-term and a longer sustained effect resulting in less knee pain , better physical function , and attenuation of systemic inflammation in older patients with knee OA ( ClinicalTrials.gov identifier NCT01619163 ) ."
"Emotional eating is associated with overeating and the development of obesity . Yet , empirical evidence for individual ( trait ) differences in emotional eating and cognitive mechanisms that contribute to eating during sad mood remain equivocal .The aim of this study was to test if attention bias for food moderates the effect of self-reported emotional eating during sad mood ( vs neutral mood ) on actual food intake . It was expected that emotional eating is predictive of elevated attention for food and higher food intake after an experimentally induced sad mood and that attentional maintenance on food predicts food intake during a sad versus a neutral mood .Hierarchical multivariate regression modeling showed that self-reported emotional eating did not account for changes in attention allocation for food or food intake in either condition . Yet , attention maintenance on food cues was significantly related to increased intake specifically in the neutral condition , but not in the sad mood condition .","The current findings show that self-reported emotional eating ( based on the DEBQ ) might not validly predict who overeats when sad , at least not in a laboratory setting with healthy women . Results further suggest that attention maintenance on food relates to eating motivation when in a neutral affective state , and might therefore be a cognitive mechanism contributing to increased food intake in general , but maybe not during sad mood ."
"Although working smoke alarms halve deaths in residential fires , many households do not keep alarms operational . We tested whether theory-based education increases alarm operability . http://www.clinicaltrials.gov number NCT00139126 .Homes in the Full Education and Practice arms were more likely to have a functioning smoke alarm at follow-up ( OR = 2.77 , 95 % CI 1.09 to 7.03 ) and had an average of 0.32 more working alarms per home ( 95 % CI 0.09 to 0.56 ) . Working alarms per home rose 16 % . Full Education and Practice had similar effectiveness ( p = 0.97 on both outcome measures ) .","Without exceeding typical fire department installation time , installers can achieve greater smoke alarm operability . Hands-on practice is key . Two years after installation , for every three homes that received hands-on practice , one had an additional working alarm ."
"This study was sponsored by a grant from the pharmaceutical company Laboratoires Urgo . S. Bohbot and O. Tacca are employees of Laboratoires Urgo . S. Meaume , J. Dissemond and G. Perceau have received monetary compensation as presenters for Laboratoires Urgo . Data management and statistical analyses were conducted independently by Vertical ( Paris , France ) .To evaluate the performance ( efficacy , safety and acceptability ) of a new micro-adherent absorbent dressing ( UrgoClean ) compared with a hydrofiber dressing ( Aquacel ) in the local management of venous leg ulcers , in the debridement stage .Altogether , 159 patients were randomised to either UrgoClean ( test group ; n = 83 ) or Aquacel ( control group ; n = 76 ) dressings . Regarding the wound healing process predictive factors ( wound area , duration , ABPI value , recurrence ) , at baseline , the two groups were well balanced , for both wound and patient characteristics . Compression therapy was administered to both groups and after a median 42-day treatment period , the percentage of relative reduction of the wound surface area was very similar ( -36.9 % vs -35.4 % in the UrgoClean and control groups , respectively ) . When considering the secondary criteria at week 6 , the relative reduction of sloughy tissue was significantly higher in the UrgoClean group than in the control group ( -65.3 % vs -42,6 % ; p = 0.013 ) . The percentage of debrided wounds was also significantly higher in the test group ( 52.5 % vs 35.1 % ; p = 0.033 ) .","This ` EARTH ' RCT confirmed that the UrgoClean dressing has similar efficacy and safety compared to Aquacel . However , UrgoClean also showed better autolytic properties than the control group in the management of venous leg ulcers at the sloughy stage . The new UrgoClean dressing therefore represents a promising therapeutic option within the current range of autolytic dressings available ."
"Eye movements ( EM ) during recall of an aversive memory is a treatment element unique to Eye Movement Desensitization and Reprocessing ( EMDR ) . Experimental studies have shown that EM reduce memory vividness and/or emotionality shortly after the intervention . However , it is unclear whether the immediate effects of the intervention reflect actual changes in memory . The aim of this study was to test whether immediate reductions in memory vividness and emotionality persist at a 24h follow up and whether the magnitude of these effects is related to the duration of the intervention .In both duration groups , recall with EM , but not recall only , caused an immediate decrease in memory vividness . There were no immediate reductions in memory emotionality . Furthermore , only the ` eight periods ' group showed that recall with EM , but not recall only , caused a decrease in both memory emotionality and memory vividness from the pre-test to the follow-up .","Only self-report measures were used . The findings suggest that recall with EM causes 24-hchanges in memory vividness/emotionality , which may explain part of the EMDR treatment effect , and these effects are related to intervention duration ."
"Few studies have tested the impact of motivational interviewing ( MI ) delivered by primary care providers on pediatric obesity . This study tested the efficacy of MI delivered by providers and registered dietitians ( RDs ) to parents of overweight children aged 2 through 8 .At 2-year follow-up , the adjusted BMI percentile was 90.3 , 88.1 , and 87.1 for groups 1 , 2 , and 3 , respectively . The group 3 mean was significantly ( P = .02 ) lower than group 1 . Mean changes from baseline in BMI percentile were 1.8 , 3.8 , and 4.9 across groups 1 , 2 , and 3 .","MI delivered by providers and RDs ( group 3 ) resulted in statistically significant reductions in BMI percentile . Research is needed to determine the clinical significance and persistence of the BMI effects observed . How the intervention can be brought to scale ( in particular , how to train physicians to use MI effectively and how best to train RDs and integrate them into primary care settings ) also merits future research ."
"Antithrombin ( AT ) concentrations are reduced after cardiac surgery with cardiopulmonary bypass compared with the preoperative levels . Low postoperative AT is associated with worse short - and mid-term clinical outcomes . The aim of the study is to evaluate the effects of AT administration on activation of the coagulation and fibrinolytic systems , platelet function , and the inflammatory response in patients with low postoperative AT levels .Compared with the no AT group and control patients , patients receiving AT showed significantly higher AT values until 48 hours after the last administration . Analysis of variance for repeated measures showed a significant effect of study treatment in reducing prothrombin fragment 1-2 ( p = 0.009 ; interaction with time sample , p = 0.006 ) and plasmin-antiplasmin complex ( p < 0.001 ; interaction with time sample , p < 0.001 ) values but not interleukin 6 ( p = 0.877 ; interaction with time sample , p = 0.521 ) and platelet factor 4 ( p = 0.913 ; interaction with time sample , p = 0.543 ) . No difference in chest tube drainage , reopening for bleeding , and blood transfusion was observed .",Antithrombin administration in patients with low AT activity after surgery with cardiopulmonary bypass reduces postoperative thrombin generation and fibrinolysis with no effects on platelet activation and inflammatory response .
"Early invasive management is recommended for high-risk non-ST-segment elevation acute coronary syndromes .We evaluated patients at tertiary [ both percutaneous coronary intervention ( PCI ) and coronary artery bypass grafting ( CABG ) capable ] and primary hospitals in the EARLY-ACS trial .There were 348 tertiary ( n = 7,455 patients ) and 89 primary hospitals [ n = 1,749 patients ( 729 transferred ; 1,020 non-transfer ) ] . Significant delays occurred in time from symptom onset to angiography ( 49 hr ) , PCI ( 53h ) , and CABG ( 178 hr ) for transferred patients ( P < 0.001 ) . Non-transfer patients had less 30-day death/myocardial infarction [ 9.4 % vs. 11.7 % ( tertiary ) ; adjusted odds ratio ( OR ) : 0.78 ( 0.62-0 .97 ) , P = 0.026 ] ; transferred ( 14.0 % ) and tertiary patients were similar [ adjusted OR : 1.23 ( 0.98-1 .53 ) , P = 0.074 ] . Non-transfer patients had lower 1-year mortality [ 4.3 % vs. 6.3 % ( tertiary ) ; adjusted hazard ratio ( HR ) : 0.64 ( 0.47-0 .87 ) , P = 0.005 ] : there was no difference between transferred and tertiary patients [ 5.2 % vs. 6.3 % ; adjusted HR : 0.80 ( 0.58-1 .12 ) , P = 0.202 ] . Despite similar rates of catheterization , GUSTO severe/moderate bleeding within 120 hr was less in non-transfer [ 3.1 % vs. 6.7 % ( tertiary ) ; adjusted OR : 0.47 ( 0.32-0 .68 ) , P < 0.001 ] , whereas transferred ( 6.1 % ) and tertiary patients were similar [ adjusted OR : 0.94 ( 0.68-1 .30 ) , P = 0.693 ] . There was no difference in non-CABG bleeding .",Timely angiography and revascularization were often not achieved in transferred patients . Non-transferred patients presenting to primary sites had the lowest event rates and the best long-term survival .
"We hypothesized that a targeted temperature of 33 C as compared to that of 36 C would increase survival and reduce the severity of circulatory shock in patients with shock on admission after out-of-hospital cardiac arrest ( OHCA ) .There was no significance difference between targeted temperature management at 33 C or 36 C on 180-day mortality [ log-rank test , p = 0.17 , hazard ratio 1.33 , 95 % confidence interval ( CI ) 0.88-1 .98 ] or ICU mortality ( 61 vs. 44 % , p = 0.06 ; relative risk 1.37 , 95 % CI 0.99-1 .91 ) . Serum lactate and the extended cardiovascular SOFA score were higher in the TTM33 group ( p < 0.01 ) .",We found no benefit in survival or severity of circulatory shock with targeted temperature management at 33 C as compared to 36 C in patients with shock on admission after OHCA .
"Youths with a family history of alcohol and other drug use disorders ( FH + ) are at a greater risk of developing substance use disorders than their peers with no such family histories ( FH - ) , and this increased risk may be related to impaired maturation of forebrain circuitry . FH + individuals have shown altered forebrain activity at rest and while performing cognitive tasks . However , it is not fully understood how forebrain activity is altered in FH + individuals , and ultimately how these alterations may contribute to substance use disorder risk .FH + youths had significantly greater cerebral activations in both the Go and Go/NoGo blocks than FH - youths in regions including the posterior cingulate/precuneus , bilateral middle/superior temporal gyrus , and medial superior frontal gyrus with no significant group differences in the subtraction between Go Only and Go/NoGo blocks . Additionally , FH + youths had moderately slower reaction times on go trials in the Go Only blocks .",Our findings suggest that global activation increase in FH + youths are modulated by FH density and are not specific to the inhibitory components of the task . This pattern of increased activations in FH + youths may be at least partially due to impaired forebrain white matter development leading to greater activations/less efficient neural communication during task performance .
"Risk factors have been proposed for running injuries including ( a ) reduced muscular strength , ( b ) excessive joint movements and ( c ) excessive joint moments in the frontal and transverse planes . To date , many running injury prevention programs have focused on a `` top down '' approach to strengthen the hip musculature in the attempt to reduce movements and moments at the hip , knee , and/or ankle joints . However , running mechanics did not change when hip muscle strength increased . It could be speculated that emphasis should be placed on increasing the strength of the ankle joint for a `` ground up '' approach . Strengthening of the large and small muscles crossing the ankle joint is assumed to change the force distribution for these muscles and to increase the use of smaller muscles . This would be associated with a reduction of joint and insertion forces , which could have a beneficial effect on injury prevention . However , training of the ankle joint as an injury prevention strategy has not been studied . Ankle strengthening techniques include isolated strengthening or movement-related strengthening such as functional balance training . There is little knowledge about the efficacy of such training programs on strength alteration , gait or injury reduction . Current Controlled Trial NCT01900262 .",Avoiding injury will allow individuals to enjoy the benefits of participating in aerobic activities and reduce the healthcare costs associated with running injuries .
"Vitamin B12 deficiency causes neurologic and psychiatric disease , especially in older adults . Subacute combined degeneration is characterized by damage to the posterior and lateral spinal cord affecting the corticospinal tract .To test corticospinal tract projections using motor evoked potentials ( MEPs ) by transcranial magnetic stimulation ( TMS ) in asymptomatic older adults with low vitamin B12 ( B12 ) levels .Median age was 74.33.6 years ( 58.5 % women ) . Twenty-six out of the 53 subjects had low vitamin B12 levels ( B12 < 221pmol/l ) . MEPs were recorded for all subjects in upper and lower extremities . There were no significant differences in either latency or amplitude of MEPs and CMCT between low and normal B12 groups . There was a significant PMCT delay in the lower extremities in the low B12 group ( p = 0.014 ) .",No subclinical abnormality of the corticospinal tract is detected in asymptomatic B12-deficient older adults . The peripheral nervous system appears to be more vulnerable to damage attributable to this vitamin deficit . The neurophysiological evaluation of asymptomatic older adults with lower B12 levels should be focused mainly in peripheral nervous system evaluation .
"Uncontrolled hypertension ( HTN ) is a significant public health problem among blacks in the United States . Despite the proven efficacy of therapeutic lifestyle change ( TLC ) on blood pressure ( BP ) reduction in clinical trials , few studies have examined their effectiveness in church-based settings-an influential institution for health promotion in black communities .","If successful , this trial will provide an alternative and culturally appropriate model for HTN control through evidence-based lifestyle modification delivered in churches by lay health advisors ."
"The classification of clinical severity of Ebstein anomaly still remains a challenge . The aim of this study was to focus on the interaction of the pathologically altered right heart with the anatomically-supposedly-normal left heart and to derive from cardiac magnetic resonance ( CMR ) a simple imaging measure for the clinical severity of Ebstein anomaly .Twenty-five patients at a mean age of 2614 years with unrepaired Ebstein anomaly were examined in a prospective study . Disease severity was classified using CMR volumes and functional measurements in comparison with heart failure markers from clinical data , ECG , laboratory and cardiopulmonary exercise testing , and echocardiography . All examinations were completed within 24 hours . A total right/left-volume index was defined from end-diastolic volume measurements in CMR : total right/left-volume index = ( RA + aRV + fRV ) / ( LA+LV ) . Mean total right/left-volume index was 2.61.7 ( normal values : 1.10.1 ) . This new total right/left-volume index correlated with almost all clinically used biomarkers of heart failure : brain natriuretic peptide ( r = 0.691 ; P = 0.0003 ) , QRS ( r = 0.432 ; P = 0.039 ) , peak oxygen consumption/kg ( r = -0.479 ; P = 0.024 ) , ventilatory response to carbon dioxide production at anaerobic threshold ( r = 0.426 ; P = 0.048 ) , the severity of tricuspid regurgitation ( r = 0.692 ; P = 0.009 ) , tricuspid valve offset ( r = 0.583 ; P = 0.004 ) , and tricuspid annular plane systolic excursion ( r = 0.554 ; P = 0.006 ) . Previously described severity indices ( [ RA + aRV ] / [ fRV + LA+LV ] ) and fRV/LV end-diastolic volume corresponded only to some parameters .","In patients with Ebstein anomaly , the easily acquired index of right-sided to left-sided heart volumes from CMR correlated well with established heart failure markers . Our data suggest that the total right/left-volume index should be used as a new and simplified CMR measure , allowing more accurate assessment of disease severity than previously described scoring systems ."
"Limited data are available on the efficacy of beta-blocker therapy for secondary prevention in STEMI patients .This study sought to investigate the association of beta-blocker therapy at discharge with clinical outcomes in patients with ST-segment elevation myocardial infarction ( STEMI ) after primary percutaneous coronary intervention ( PCI ) .The median follow-up duration was 367 days ( interquartile range : 157 to 440 days ) . All-cause death occurred in 146 patients ( 2.1 % ) of the beta-blocker group versus 59 patients ( 3.6 % ) of the no-beta-blocker group ( p < 0.001 ) . After 2:1 propensity-score matching , beta-blocker therapy was associated with a lower incidence of all-cause death ( 2.8 % vs. 4.1 % , adjusted hazard ratio : 0.46 , 95 % confidence interval : 0.27 to 0.78 , p = 0.004 ) . The association with better outcome of beta-blocker therapy in terms of all-cause death was consistent across various subgroups , including patients with relatively low-risk profiles such as ejection fraction > 40 % or single-vessel disease .","Beta-blocker therapy at discharge was associated with improved survival in STEMI patients treated with primary PCI . Our results support the current American College of Cardiology/American Heart Association guidelines , which recommend long-term beta-blocker therapy in all patients with STEMI regardless of reperfusion therapy or risk profile ."
"Local anesthetic wound infiltration is widely used as an effective adjunct during multimodal postoperative pain management . The aim of this study was to evaluate the effectiveness of continuous wound infusion of ropivacaine in postoperative pain relief , opioid sparing , incidence of nausea and vomiting , and bowel and liver function improvement in patients undergoing open hepatectomy .Pain scores at rest were lower for the ropivacaine group and reached significance after 8 and 16 hours ( P < 0.01 ) . Sufentanil consumption ( 41.5021.80 vs. 89.7035.22 g ; P < 0.01 ) after 48 hours , time to bowel recovery ( 1.800.70 vs. 3.151.04 d ; P < 0.01 ) , incidence of nausea and vomiting ( 1.750.72 vs. 2.400.68 ; P < 0.05 ) , and mean length of hospitalization ( 5.62.44 vs. 7.352.85 d ; P < 0.01 ) were significantly reduced , and the sedation score and liver function change were also comparable between the 2 groups . There was no difference with respect to pain scores on movement , nor with respect to patient satisfaction .",Surgical wound infusion with ropivacaine after hepatectomy can improve pain relief at rest and accelerate recovery and discharge .
"Tuberculosis ( TB ) is highly prevalent among HIV-infected people , including those receiving combination antiretroviral therapy ( cART ) , necessitating a well tolerated and efficacious TB vaccine for these populations . We evaluated the safety and immunogenicity of the candidate TB vaccine M72/AS01 in adults with well controlled HIV infection on cART .Thirty-seven individuals [ interquartile range ( IQR ) CD4 cell counts at screening : 438-872 cells/l ; undetectable HIV-1 viremia ] were enrolled ; 73 % of individuals reported previous BCG vaccination , 97.3 % tested negative for the QuantiFERON-TB assay . For M72/AS01 recipients , no vaccine-related serious AEs or cART-regimen adjustments were recorded , and there were no clinically relevant effects on laboratory safety parameters , HIV-1 viral loads or CD4 cell counts . M72/AS01 was immunogenic , inducing persistent and polyfunctional M72-specific CD4 T-cell responses [ medians 0.70 % ( IQR 0.37-1 .07 ) at D60 ] and 0.42 % ( 0.24-0 .61 ) at D210 , predominantly CD40LIL-2TNF - , CD40LIL-2 and CD40LIL-2TNF-IFN - ] . All M72/AS01 vaccines were seropositive for anti-M72 IgG after second vaccination until study end .","M72/AS01 was clinically well tolerated and immunogenic in this population , supporting further clinical evaluation in HIV-infected individuals in TB-endemic settings ."
"The aim of this study was to investigate whether remedial hydration ( RH ) reduces the incidence of contrast-induced nephropathy ( CIN ) and short-term adverse events in ST-elevation myocardial infarction ( STEMI ) patients undergoing primary percutaneous coronary intervention ( PCI ) .The incidence of CIN in the RH group was lower than that observed in the control group ( 22/108 ; 20.4 % vs. 38/108 ; 35.2 % , p < 0.05 ) . The subgroup analysis showed that the rate of CIN was lower in the moderate ( 6/29 ; 20.7 % vs. 13/30 ; 43.3 % , p < 0.10 ) and significantly lower in both the high ( 5/21 ; 23.8 % vs. 10/18 ; 55.6 % , p < 0.05 ) and very high score groups ( 3/12 ; 25.0 % vs. 8/12 ; 66.7 % , p < 0.05 ) among the RH patients compared to the controls . At 24 , 48 and 72 hours after PCI , the patients in the RH group exhibited lower SCr levels and higher CCr levels than the patients in the control group ( both p < 0.05 ) . A lower incidence of in-hospital clinical events was also observed in the RH group .",Remedial hydration decreases the occurrence of CIN and improves the short-term prognosis of STEMI patients undergoing primary PCI .
"An increased production of oxidizing species related to reactive oral diseases , such as chronic apical periodontitis , could have systemic implications such as an increase in cardiovascular morbidity . Based on this consideration , we conducted a prospective study to assess whether subjects affected by chronic periodontitis presented with higher values of oxidative stress than reference values before endodontic treatment , and whether endodontic treatment can reduce the oxidative imbalance and bring it back to normal in these subjects .It was found that , on recruitment , the patients with chronic apical periodontitis exhibited significantly higher levels of oxidative stress than control patients , as determined by the d-ROMs and BAP tests . Furthermore , the d-ROMs test values were shown to decrease and the BAP test values to increase over time in patients with chronic apical periodontitis following endodontic therapy . As the levels of oxidative stress in these patients tended to reduce and return to normal by 90 days following treatment .","This study has demonstrated a positive association between chronic apical periodontitis and oxidative stress . Subjects affected by chronic apical periodontitis are exposed to a condition of oxidative stress , which is extremely dangerous to general health . Moreover , one can infer from these findings that through proper endodontic therapy , a good oxidative balance can be restored , thereby avoiding the risk of contracting the abovementioned diseases ."
