"The purpose of this multicenter , open label , randomized phase III study was to determine whether ixabepilone resulted in improved overall survival ( OS ) compared with commonly used single-agent chemotherapy ( doxorubicin or paclitaxel ) in women with locally advanced , recurrent , or metastatic endometrial cancer with at least one failed prior platinum-based chemotherapeutic regimen .At the time of database lock , 496 patients were randomized to receive ixabepilone ( n = 248 ) or control ( n = 248 ) ; nine patients in the control arm were not treated . The interim analysis of futility for OS ( 219 events ) favored the control chemotherapy arm ( hazard ratio = 1.3 [ 95 % confidence interval : 1.0-1 .7 ] , stratified log rank test P = 0.0397 ) , indicating that the study would not meet its primary objective . The study was discontinued based on the interim OS results . The frequency of adverse events was comparable between the treatment arms .",The study did not meet its primary objective of improving OS in the ixabepilone arm compared to the control chemotherapy arm . A favorable risk/benefit ratio was not observed for ixabepilone versus control at the time of the interim analysis . The safety results were consistent with the known safety profiles of ixabepilone and control .
"To determine the impact of calcium and phosphorus on radiological and biochemical characteristics of osteopenia in premature infants .Radiological changes , characteristic of osteopenia , were found in 8 ( 40 % ) cases and 13 ( 65 % ) controls ( p < 0.113 ) . The mean of weight , length and head circumference increased significantly from second to sixth week during follow-up ( p < 0.0001 ) . Phosphorus and alkaline phosphatase activity decreased significantly from second to sixth week of follow-up ( p < 0.02 , p < 0.01 respectively ) . However , repeated measurement analyses did not show significant effect of intervention in biochemical and growth parameters in the trial group .",The study did n't show significant effect of calcium and phosphorus on prevention of osteopenia and improvement of growth . Further studies of longer duration and with different doses of supplement are recommended .
"CHF has been shown to be associated with inflammatory activation . Inflammation has been designated as a therapeutic target in CHF .The purpose of this study was to test the efficacy of a 6-month course of anti-inflammatory treatment with colchicinein improving functional status of patients with stable chronic heart failure ( CHF ) .Two hundred sixty-seven patients were available for final evaluation of the primary endpoint : its rate was 11 % in the control group and 14 % in the colchicine group ( odds ratio : 1.40 ; 95 % confidence interval : 0.67 to 2.93 ; p = 0.365 ) . The rate of the composite of death or hospital stay for heart failure was 9.4 % in the control group , compared with 10.1 % in the colchicine group ( p = 0.839 ) . The changes in treadmill exercise time with treatment were insignificant and similar in the 2 groups ( p = 0.938 ) . C-reactive protein and interleukin-6 were both significantly reduced in the colchicine group ( -5.1 mg/l and -4.8 pg/ml , respectively ; p < 0.001 for both , compared with the control group ) .","According to this prospective , randomized study , anti-inflammatory treatment with colchicine in patients with stable CHF , although effective in reducing inflammation biomarker levels , did not affect in any significant way patient functional status ( in terms of New York Heart Association class and objective treadmill exercise tolerance ) or the likelihood of death or hospital stay for heart failure ."
"ClinicalTrials.gov identifier : NCT00101452 .To examine the comparative antidepressant efficacy of S-adenosyl-L-methionine ( SAMe ) and escitalopram in a placebo-controlled , randomized , double-blind clinical trial .All 3 treatment arms demonstrated a significant improvement of about 5-6 points in HDRS-17 scores ( P < .001 for all ) , and no significant differences were observed between the treatment arms ( P > .05 for all ) . Response rates in the intent-to-treat sample were 36 % for SAMe , 34 % for escitalopram , and 30 % for placebo . Remission rates were 28 % for SAMe , 28 % for escitalopram , and 17 % for placebo . No comparisons between treatment groups attained significance ( P > .05 for all ) . Tolerability was good , with gastrointestinal side effects ( 19 % for stomach discomfort and 20 % for diarrhea ) as the most common in the SAMe arm . Significant differences were observed between treatment groups for dizziness , anorgasmia , diminished mental acuity , and hot flashes ( P < .05 for all ) .",The results fail to support an advantage over placebo for either the investigational treatment SAMe or the standard treatment escitalopram for MDD .
"Total weight loss induced by energy restriction is highly variable even under tightly controlled conditions . Identifying weight-loss discriminants would provide a valuable weight management tool and insights into body weight regulation .This study characterized responsiveness to energy restriction in adults from variables including the plasma metabolome , endocrine and inflammatory markers , clinical indices , body composition , diet , and physical activity .Both pre - and postintervention variables ( n = 127 ) were identified as weight-loss discriminants ( root mean squared error of prediction = 1.85 kg ; Q ( 2 ) = 0.43 ) . Compared with low-responders ( LR ) , high-responders ( HR ) had greater decreases in body weight ( LR : 2.7 1.6 kg ; HR : 9.4 1.8 kg , P < 0.01 ) , BMI ( in kg/m ( 2 ) ; LR : 1.0 0.6 ; HR : 3.3 0.5 , P < 0.01 ) , and total fat ( LR : 2.2 1.1 kg ; HR : 8.0 2.1 kg , P < 0.01 ) . Significant group effects unaffected by the intervention were determined for the respiratory exchange ratio ( LR : 0.86 0.05 ; HR : 0.82 0.03 , P < 0.01 ) , moderate physical activity ( LR : 127 52 min ; HR : 167 68 min , P = 0.02 ) , sedentary activity ( LR : 1090 99 min ; HR : 1017 110 min , P = 0.02 ) , and plasma stearate [ LR : 102,000 21,000 quantifier ion peak height ( QIPH ) ; HR : 116,000 24,000 QIPH , P = 0.01 ] .","Overweight and obese individuals highly responsive to energy restriction had accelerated reductions in adiposity , likely supported in part by higher lipid mobilization and combustion . A novel observation was that person-to-person differences in habitual physical activity and magnitude of weight loss were accompanied by unique blood metabolite signatures . This trial was registered at clinicaltrials.gov as NCT00858312 ."
"Endovascular repair of abdominal aortic aneurysm ( AAA ) has recently been made a class I indication in the treatment of AAA . In comparison to the conventional open surgical treatment , endovascular AAA repair ( EVAR ) is associated with equivalent long-term morbidity and mortality rates . Vascular surgeons perform majority of EVAR . There are no reports for the long-term results of this intervention performed by interventional cardiologists . We present one of the first reports of periprocedural and long-term outcomes of EVAR performed by interventional cardiologists .During the study period EVAR was attempted in 170 patients , with 27 % being women . The mean age was 74 years ( range 52-93 ) . The endovascular graft placement was successful in 96 % ( 163/170 ) of patients . Procedure failures were more common in women ( 6 of 46 vs 1 of 124 , P = 0.003 ) . The 30-day mortality was 1.8 % ( 3 of 170 ) . In patients with successful EVAR the mean follow-up was 30 months and mean length of hospital stay was 3.53.2 days . Major periprocedural complications were noted in 9 % patients ( 15 of 167 ) . During follow-up , six patients ( 3.5 % ) required re-intervention and additional 16 patients died with no aneurysm related deaths .",EVAR primarily performed by interventional cardiologists demonstrates high periprocedural and long-term success rates . A higher EVAR failure rate has been observed in women .
"Anorexia nervosa ( AN ) is a severe illness with high rates of relapse . Exposure and Response Prevention for AN ( AN-EXRP ) is a new approach that specifically addresses maladaptive eating behavior by targeting eating-related fear and anxiety . The aim of this study was to evaluate AN-EXRP as an adjunctive strategy to improve eating behavior during weight restoration , at a pivotal moment when treatment goals shift toward relapse prevention .The average test meal caloric intake of participants who received AN-EXRP increased from 352263 kcal at baseline to 401215 kcal post-treatment , while that of participants who received CRT decreased from 501232 kcal at baseline to 424221 kcal post-treatment [ t ( 28 ) = 2.5 , p = .02 ] . Improvement in intake was significantly associated with improvement in eating-related anxiety ( Spearman 's = 0.40 , p = .03 ) .","These data demonstrate that AN-EXRP , compared to a credible comparison intervention , is associated with better caloric intake in a laboratory meal over time in AN . Additional studies are required to determine whether incorporation of these techniques into a longer treatment program leads to enduring and clinically significant change ."
"Aggressive behaviour in psychosis is not uncommon . Community provision for people with psychosis has left informal caregivers to take on a greater role in their care . However , few studies have explored links between patient-initiated violence in mental health caregiving relationships and caregiver functioning . Our study investigated caregiver reports of aggressive acts committed by their relative with psychosis and their links to caregiver appraisals of the caregiving relationship and caregiver outcomes .One-half of the caregiver sample ( 52.9 % ) reported an incident of patient-initiated violence during their interview ; 62.2 % of these involved violence toward themselves , and 24.3 % toward property . Reports of patient violence were associated with caregiver ratings of hostility expressed toward patients , lower self-esteem , and emotion-focused coping . People caring on their own were more likely to report incidents of patient violence . Younger patients , males , and inpatients were more frequently identified as having a history of this kind of violence .","Our findings suggested that caregiver reports of patient-initiated violence in psychosis are not uncommon . Mental health staff need to be aware of the risks of such violence for caregivers of people with psychosis , and consider appropriate procedures for minimizing it ."
"Positive-pressure ventilation during transport of intubated patients is generally delivered via a hand-pressurized device . Of these devices , self-inflating resuscitators ( SIR ) and flow-inflating resuscitators ( FIR ) constitute the two major types used . Selection of a particular device for transport , however , remains largely an institutional practice .To evaluate the hypothesis that transport ventilation goals of intubated pediatric patients are better achieved using an FIR compared to an SIR .Overall , participants were four times more likely to deliver target breaths and one-third less likely to deliver unacceptable breaths using the FIR compared to the SIR . When comparing device performance , a 44 % increase in the proportions of target breaths and a 40.4 % decrease in unacceptable breaths using the FIR were observed ( P < 0.0001 for both ) .",Hand ventilation during patient transport is superior using the FIR compared to the SIR to achieve target ventilatory goals and avoid unacceptable ventilatory cycles .
"To examine efficacy of hysteroscopic removal of polyps and myomas on health-related quality of life and symptom severity at 1-year postprocedure .A total of 118 lesions ( 76 polyps , 42 myomas ) were removed . Among the 118 pathologies removed , 53 were removed in an office setting ( 28 myomas , 25 polyps ) , and 55 were removed in an ambulatory surgical center ( ASC ) setting ( 14 myomas , 41 polyps ) . The mean percentage of pathology removed was 95.96.8 % for fibroids and 99.9 0.7 % for polyps . Symptom severity as measured by the Uterine Fibroid Symptom-Quality of Life ( UFS-QOL ) scale improved significantly ( p < .01 ) between baseline ( mean score of 67.515.4 ) and 12months postprocedure ( mean score of 22.322.6 ) . The Health-Related Quality of Life ( HRQOL ) scale also improved significantly ( p < .01 ) between baseline ( mean score 38.723.3 ) and 12months postprocedure ( mean score of 83.924.4 ) . Both the office and ASC groups demonstrated a statistically significant ( p < .01 ) improvement in UFS-QOL and HRQOL .","For women with intrauterine polyps and/or myomas who experienced abnormal uterine bleeding , hysteroscopic morcellation with the MyoSure device provided significant , durable health-related , quality-of-life improvements up to 12months postprocedure . These findings were the same for patients treated in both an office-based setting and ASCs ."
"To evaluate the effects of a home-monitoring device with tele-monitoring compared with standard care in detection of progression to choroidal neovascularization ( CNV ) associated with age-related macular degeneration ( AMD ) , the leading cause of blindness in the US .",HOME Study is the first large scale study to test the use of home tele-monitoring system in the management of AMD patients .
"Avastin Biomarkers In lunG And 3D Innovative anaLysis ( ABIGAIL ) , which is a phase II , open-label , randomized study , investigated correlations between biomarkers and best overall response to bevacizumab plus platinum-doublet chemotherapy for patients with advanced/recurrent non-small-cell lung cancer .Patients were randomized to receive chemotherapy plus 7.5 mg/kg ( n = 154 ) or 15 mg/kg ( n = 149 ) bevacizumab . For the primary analysis , none of the baseline plasma biomarkers correlated with best overall response . Exploratory analyses showed that low VEGF-A levels were associated with longer progression-free survival ( 7.4 versus 6.1 months ; hazard ratio , 1.57 ; 95 % confidence intervals , 1.17 to 2.09 ; p = 0.002 ) and overall survival ( 19.8 versus 11.1 months ; hazard ratio , 1.57 ; 95 % confidence interval , 1.15-2 .13 ; p = 0.004 ) compared with these in high baseline plasma VEGF-A levels . No plasma biomarkers changed significantly over time . No significant correlations were observed between tumor biomarkers and clinical outcomes . No new safety signals were observed .","Baseline and/or dynamic changes in plasma basic fibroblast growth factor , E-selectin , intercellular adhesion molecule-1 , placental growth factor , VEGFR-1 and VEGFR-2 , and tumor biomarkers did not correlate statistically with treatment outcomes for bevacizumab plus chemotherapy . Only baseline plasma VEGF-A was significantly correlated with progression-free survival/overall survival ."
"Evidence from armed conflict settings points to high levels of intimate partner violence ( IPV ) against women . Current knowledge on how to prevent IPV is limited-especially within war-affected settings . To inform prevention programming on gender-based violence in settings affected by conflict , we evaluated the impact of adding a targeted men 's intervention to a community-based prevention programme in Cte d'Ivoire . clinicaltrials.gov NCT01803932 .At follow-up , reported levels of physical and/or sexual IPV in the intervention arm had decreased compared to the control arm ( ARR 0.52 , 95 % CI 0.18-1 .51 , not significant ) . Men participating in the intervention reported decreased intentions to use physical IPV ( ARR 0.83 , 95 % CI 0.66-1 .06 ) and improved attitudes toward sexual IPV ( ARR 1.21 , 95 % CI 0.77-1 .91 ) . Significant differences were found between men in the intervention and control arms ' reported ability to control their hostility and manage conflict ( ARR 1.3 , 95 % CI 1.06-1 .58 ) , and participation in gendered household tasks ( ARR 2.47 , 95 % CI 1.24-4 .90 ) .","This trial points to the value of adding interventions working with men alongside community activities to reduce levels of IPV in conflict-affected settings . The intervention significantly influenced men 's reported behaviours related to hostility and conflict management and gender equitable behaviours . The decreased mean level of IPV and the differences between intervention and control arms , while not statistically significant , suggest that IPV in conflict-affected areas can be reduced through concerted efforts to include men directly in violence prevention programming . A larger-scale trial is needed to replicate these findings and further understand the mechanisms of change ."
"This paper describes the rationale , design , and methods of a two-year randomized controlled trial conducted to evaluate the effectiveness of an environmental intervention in 27 elementary schools in Mexico City .Primary outcomes were overweight and obesity prevalence and fitness ; environmental and behavioural measures were also examined .","This is the first institutional multilevel , multifactorial project , consistent with the best practices available in current literature , carried out in Mexico to prevent childhood obesity in schools ."
"PF-04447943 is a potent , selective phosphodiesterase 9A ( PDE9A ) inhibitor that elevates guanoscine 3 ' ,5 ' - cyclic monophosphate ( cGMP ) in brain and cerebrospinal fluid . PDE9A inhibition enhances synaptic plasticity and improves memory in preclinical cognition models , and prevents decreases in dendritic spine density in transgenic mice that overexpress amyloid precursor protein ( APP ) leading to high levels of amyloid beta ( A ) production ( Tg2576 ) .This Phase 2 multicenter study was designed to assess the efficacy , safety and pharmacokinetics of PF-04447943 compared with placebo in mild to moderate probable Alzheimer 's disease ( AD ) .Completion rates were similar , 87 % PF-04447943 vs 92 % placebo . At week 12 the mean ( SE ) baseline adjusted decrease from baseline in ADAS cog for PF-04447943-treated patients was -1.91 ( 0.54 ) . Placebo treated patients had a change of -1.60 ( 0.50 ) . The difference between treatments was -0.31 ( 90 % CI of -1.52 , 0.90 ) . Corresponding values for the NPI were -2.86 ( 0.72 ) vs -2.70 ( 0.67 ) with a treatment difference of -0.16 ( 90 % CI of -1.78 , 1.48 ) . Neither these changes nor the distribution of CGI-I scores were statistically significantly different between groups . The incidence of serious adverse events ( AEs ) was similar between groups with 2 deaths in the placebo group . The PF-04447943 group reported more gastrointestinal AEs including diarrhea ( 5.5 % vs 3 % ) and nausea ( 5.5 % vs 1 % ) and had a higher rate of discontinuation due to AEs ( 6.6 % vs 2 % ) .","Although generally safe and well-tolerated , 12 weeks PF-04447943 treatment did not improve cognition , behavior , and global change compared with placebo ."
"In most cases the only knowledge an individual will receive with regards to their own body and its proper functioning is during their high school education . The aim of this study was to evaluate high school students ' knowledge about basic physiology .One-thousand-and eighty-three ( out of 1179 invited -- 91.86 % ) Polish high school students ( 63.25 % female ) filled in a 20-item questionnaire constructed by the authors regarding basic human physiology . The mean age of the group was 17.66 0.80 years . The mean score among the surveyed was 10.15 3.48 ( range 0-20 ) . Only 26.04 % of students achieved a grade of 60 % or more , and only one person obtained the highest possible score . Females achieved significantly better scores than males ( 10.49 3.38 vs. 9.56 3.56 ; p < 0.0001 ) . Pupils in their second year who were in the process of studying physiology , obtained better results than those in their third year who had already finished the biology course ( 10.70 3.27 vs. 9.81 3.74 respectively ; p < 0.0001 ) and those in their first year who did not yet study human physiology ( 10.70 3.27 vs. 9.63 2.74 respectively ; p = 0.003 ) . Over 23 % of students did not know that mature red blood cells do not have cell nuclei and a similar number of them answered that humans have 500,000 erythrocytes in 1 mm3 of blood . Over 32 % believed that plasma does not participate in the transport of respiratory gases , and 31 % believed that endocrine glands secrete hormones within their immediate vicinity and into the blood .","Our research has shown that young people , especially men , often lack basic physiological knowledge needed to make conscious and responsible decisions regarding their health . Our results suggest that more emphasis should be put on properly teaching human physiology in high school , especially to those students who do not plan a career in medicine-related fields . This study brings to light the disturbing fact that about a year after a student finishes his basic physiology course his knowledge of the subject returns to a pre high school level ."
"With both a high need for recovery ( NFR ) and overweight and obesity being a potential burden for organizations ( e.g. productivity loss and sickness absence ) , the aim of this paper was to examine the associations between overweight and obesity and several other health measures and NFR in office workers . The trial is registered at the Dutch Trial Register ( NTR ) under trial registration number : NTR2553 .A significant positive association was observed between stress and NFR ( B = 18.04 , 95 % CI :14.53 -21.56 ) . General health , mental health , sleep quality and vitality were negatively associated with NFR ( p < 0.001 ) . Analyses also showed a significant positive association between obesity and NFR ( B = 8.77 , 95 % CI :0.01 -17.56 ) , but not between overweight and NFR .","The findings suggest that self-reported stress is , and obesity may be , associated with a higher NFR . Additionally , the results imply that health measures that indicate a better health are associated with a lower NFR ."
"Patients with chronic autoimmune thyroiditis have impaired health-related quality of life . The thyroid gland has a high selenium concentration , and specific selenoprotein enzyme families are crucial to immune function , and catalyze thyroid hormone metabolism and redox processes in thyroid cells . Previous randomized controlled trials have found that selenium supplementation decreases thyroid-disease-specific antibody levels . We hypothesize that selenium might be beneficial in the treatment of chronic autoimmune thyroiditis . ClinicalTrials.gov ID : NCT02013479 .","In this pragmatic trial , participating patients follow their usual treatment at their usual hospitals . In order to collect high-quality data on the clinical course and quality of life , and to minimize missing data , an elaborate trial management system has been designed . 12 months intervention duration was selected in consideration of the primary outcome , thyroid-related quality of life ."
"Asthma is a chronic inflammatory airway disease characterized by reversible obstruction , inflammation and hyperresponsiveness to different stimulus . Aerobic and breathing exercises have been demonstrated to benefit asthmatic patients ; however , there is no evidence comparing the effectiveness of these treatments . Clinicaltrials.gov ; Identifier : NCT02065258 .","Although the benefits of breathing and aerobic exercises have been extensively studied , the comparison between both has never been investigated . Furthermore , the findings of our results will allow us to understand its application and suitability to patients that will have more benefits for every intervention optimizing its effect ."
"Although whole-body vibration ( WBV ) has sparked tremendous research interest in neurorehabilitation , the cardiovascular responses to WBV in people with stroke remain unknown .The aim of this study was to determine the acute effects of different WBV protocols on oxygen consumption ( Vo2 ) , heart rate ( HR ) , rate of perceived exertion ( RPE ) , blood pressure ( BP ) , and rate-pressure product ( RPP ) during the performance of 6 different exercises among people with chronic stroke ( time since onset 6 months ) .Low-intensity and high-intensity WBV induced significantly higher Vo2 by an average of 0.69 and 0.79 mL/kg/min , respectively , compared with the control condition . These protocols also increased HR by an average of 4 bpm . The 2 WBV protocols induced higher RPE than the control condition during static standing exercise only . Although the diastolic and systolic BP and RPP were increased at the end of each exercise session , the addition of WBV had no significant effect on these variables .","The results are generalizable only to ambulatory and community-dwelling people with chronic stroke . Addition of high - and low-intensity WBV significantly increased the Vo2 and HR , but the increase was modest . Thus , WBV should not pose any substantial cardiovascular hazard in people with chronic stroke ."
