"Placebo effect has been largely studied and debated in medicine . Research focused mainly on children and adults but not on newborns . In osteopathy , few studies documented this effect and no research has been conducted in newborns .To assess the presence of placebo effect in newborns using sham osteopathic manipulative treatment .206 newborns entered the study . No difference between sham and control group was found for the primary outcome length of stay ( 30.020.3 ; 28.818.9 ; p = 0.70 ) . Multivariate analysis showed no difference between study and control group on length of stay . A negative association was found for gestational age ( -2.33 ; 95 % CI -3.81 to -0.85 ; p = 0.002 ) , birth weight ( -0.01 ; 95 % CI -0.02 to -0.01 ; p < 0.001 ) and milk volume at study enrollment ( -0.02 ; 95 % CI -0.05 to -0.01 ; p = 0.01 ) .","To the best of our knowledge , this study is the first in the field showing no placebo effect on newborns . Further discussions are opened concerning the age when placebo effect starts ."
"Clostridium difficile infection ( CDI ) is a leading cause of diarrhoea in health care settings with symptoms ranging from mild and self-limiting to life threatening . SMT19969 is a novel , non-absorbable antibiotic currently under development for the treatment of CDI . Here we report the results from a Phase I study . Current Controlled Trials . ISRCTN10858225 .Fifty-six healthy male subjects were enrolled . Following single oral doses of up to 2,000 mg in the fasted state , plasma concentrations of SMT19969 were generally below the lower limit of quantification . In the fed state levels ranged from 0.102 to 0.296 ng/mL after single dosing and after repeat dosing at Day 10 from 0.105 to 0.305 ng/mL . Following single and multiple oral doses of SMT19969 , mean daily faecal concentrations increased with increasing dose level and were significantly above the typical MIC range for C. difficile ( 0.06-0 .5 g/mL ) . At 200 mg BID , mean ( SD ) faecal concentrations of 1,466 ( 547 ) g/g and 1,364 ( 446 ) g/g were determined on days 5 and 10 of dosing respectively . No notable metabolites were detected in faeces . Overall , all doses of SMT19969 were well tolerated both as single oral doses or BID oral doses for 10 days . The majority ( 88 % ) of adverse events ( AEs ) were classified as gastrointestinal disorders and were mild in severity , resolving without treatment . The gut microbiota was analysed in the multiple dose groups with minimal changes observed in the bacterial groups analysed except for total clostridia which were reduced to below the limit of detection by day 4 of dosing .","Oral administration of SMT19969 was considered safe and well tolerated and was associated with negligible plasma concentrations after single and multiple doses . In addition , minimal disruption of normal gut microbiota was noted , confirming the highly selective spectrum of the compound . These results support the further clinical development of SMT19969 as an oral therapy for CDI ."
"While overall survival for most common cancers in Australia is improving , the rural-urban differential has been widening , with significant excess deaths due to lung , colorectal , breast and prostate cancer in regional Australia . Internationally a major focus on understanding variations in cancer outcomes has been later presentation to healthcare and later diagnosis . Approaches to reducing time to diagnosis of symptomatic cancer include public symptom awareness campaigns and interventions in primary care to improve early cancer detection . This paper reports the protocol of a factorial cluster-randomised trial of community and general practice ( GP ) level interventions to reduce the time to diagnosis of cancer in rural Western Australia ( WA ) . Ethics approval has been granted by the University of Western Australia and from all relevant hospital recruitment sites in WA . Australian New Zealand Clinical Trials Registry ( ANZCTR ) . ACTRN12610000872033 .Results of this trial will be reported in peer-reviewed publications and in conference presentations .",
"This study aimed to evaluate whether incidental CT findings of emphysema , airway thickening and bronchiectasis , as seen on CT scans performed for other non-pulmonary clinical indications , are associated with future acute exacerbations of COPD resulting in hospitalisation or death .During a median follow-up of 4.4 years ( maximum 5.2 years ) , 338 COPD events were identified . The risk of experiencing a future acute exacerbation of COPD resulting in hospitalisation or death was significantly increased in subjects with severe emphysema ( score 7 ) and severe airway thickening ( score 3 ) . The respective HRs were 4.6 ( 95 % CI 3.0 to 7.1 ) and 5.9 ( 95 % CI 3.4 to 10.5 ) . Severe bronchiectasis ( score 3 ) was not significantly associated with increased risk of adverse events ( HR 1.5 ; 95 % CI 0.9 to 2.5 ) .",Morphological correlates of COPD such as emphysema and airway thickening detected on CT scans obtained for other non-pulmonary indications are strong independent predictors of subsequent development of acute exacerbations of COPD resulting in hospitalisation or death .
"To explore the feasibility of making a preoperative diagnosis of lung adenocarcinoma shown as ground-glass nodule ( GGN ) on computed tomography ( CT ) .Significant statistic significance existed in all parameters among all groups ( P < 0.05 ) . All parameters were correlated the pathologic type of lesion . The differences were statistically significant ( P = 0.000 ) . Through the receiver operating characteristic ( ROC ) curve , between groups of preinvasive lesion and MIA , each parameter had a medium diagnostic value of 0.70-0 .90 ; between groups of MIA and IAC , size of lesion and long diameter of solid component in lesion had a medium diagnostic value of 0.70-0 .90 , longest diameter of solid component , size of solid component in lesion and proportion of GGO composition of lesion had a high diagnostic value with an AUC of > 0.90 . The CT diagnostic standard , derived from group A , was used to analyze the pathologic type of group B. And t no significant statistic significance existed between CT preoperative diagnosis and operative pathologic diagnosis ( P > 0.05 ) . The correct diagnosis rates of size of lesion , proportion of GGO composition of lesion , long diameter , longest diameter and size of solid component in lesion were 71.43 % , 76.19 % , 90.05 % , 90.05 % and 88.10 % respectively .","Based upon size of lesion , proportion of GGO composition of lesion , long diameter , longest diameter and size of solid component in lesion , preoperative CT examination may be used to determine the pathological types of lung adenocarcinoma shown as GGN ."
"Tonsillectomy surgery is associated with severe postoperative pain that usually requires analgesics including opioids . Pain control is still a big problem after tonsillectomy surgery . We aimed to evaluate the efficacy of preemptive analgesia using montelukast for pediatric post-tonsillectomy pain management . This is the first-time use of montelukast in post-tonsillectomy pain .There were statistically significant differences between group C and group M for Wong-Baker FACES pain rating scale scores ( P < .05 ) . In the 24 hours after surgery , the total number of patients using rescue analgesics was higher in group C than in group M , and the difference was statistically significant ( P < .001 ) . There was no significant difference in demographic parameters ( P > .05 ) . There were no significant differences in postoperative nausea and vomiting , otalgia , trismus , fever , or halitosis between the groups ( P > .05 ) .",Preemptive montelukast can be used safely to reduce the serious pain caused by tonsillectomy in children .
"Metastatic colon cancer patients are treated with the chemotherapy regimens , FOLFOX and FOLFIRI , in either order . So far , we can not predict the response of chemotherapeutic agent , so it is necessary to find which regimen is adequate before starting chemotherapy .Overall response rate was significantly higher in planned group ( 67.9 % vs. 46.3 % , P = 0.020 ) . In FOLFOX group , response rate was significantly improved in the planned patients ( 77.1 % vs. 50 % , P = 0.018 ) . In FOLFIRI group , the difference did n't reach statistical significance ( 50 % vs. 42.5 % , P = 0.776 ) .","We found significantly improved response rates in the chemotherapy of metastatic colon cancer by pretreatment genetic analysis , especially in FOLFOX group ."
"Cardiac arrest causes ischaemic brain injury . Arterial carbon dioxide tension ( PaCO2 ) is a major determinant of cerebral blood flow . Thus , mild hypercapnia in the 24 h following cardiac arrest may increase cerebral blood flow and attenuate such injury . We describe the Carbon Control and Cardiac Arrest ( CCC ) trial . Australian New Zealand Clinical Trials Registry ACTRN12612000690853 .","The trial commenced in December 2012 and , when completed , will provide clinical evidence as to whether targeting mild hypercapnia for 24 h following intensive care unit admission for cardiac arrest patients is feasible and safe and whether it results in decreased concentrations of neurological injury biomarkers compared with normocapnia . Trial results will also be used to determine whether a phase IIb study powered for survival at 90 days is feasible and justified ."
"For decades thiopental has been considered as the hypnotic drug of choice for intracranial surgery . However , total intravenous anesthesia performed with thiopental is associated with delayed recovery , whereas early post-operative neurological evaluation is critical . For this reason , target controlled infusion ( TCI ) of propofol is increasingly used for maintenance of anesthesia . However , a thiopental TCI has never been assessed for this purpose . We tested the hypothesis that a thiopental TCI provides an acceptable way to achieve early recovery compared to a propofol TCI during supratentorial surgery .Time to extubation was significantly ( P < 0.0001 ) shorter in group P ( median 149 minutes ; interquartile range 72-250 minutes ) than in group T ( median 453 minutes ; interquartile range 286-813 minutes ) . Similarly , the recovery parameters were significantly better in group P than in group T. There was no difference between groups in terms of patient characteristics and hemodynamic parameters .","Even with TCI and bispectral index monitoring , thiopental is associated with an inappropriate delayed recovery from supratentorial surgery compared to propofol TCI ."
"To investigate the effects of conservative therapy applied before arthroscopic subacromial decompression on the clinical outcome in patients with stage 2 shoulder impingement syndrome .Constant , UCLA , and VAS scores were statistically significantly improved in both groups after arthroscopic subacromial decompression ( P < 0.001 ) . Constant , UCLA , and VAS scores before arthroscopic subacromial decompression were statistically better in Group 1 than in Group 2 ( P < 0.001 ) . No statistically significant difference was found between the groups in terms of Constant , UCLA , and VAS scores after arthroscopic subacromial decompression ( P > 0.05 ) .",Conservative therapy applied in patients with stage 2 shoulder impingement syndrome before arthroscopic subacromial decompression does not have a positive contribution on the clinical outcome after arthroscopic subacromial decompression .
"Obstructive sleep apnea is associated with considerable health risks . Although continuous positive airway pressure ( CPAP ) can mitigate these risks , effectiveness can be reduced by inadequate adherence to treatment . We evaluated the clinical safety and effectiveness of upper-airway stimulation at 12 months for the treatment of moderate-to-severe obstructive sleep apnea .The study included 126 participants ; 83 % were men . The mean age was 54.5 years , and the mean body-mass index ( the weight in kilograms divided by the square of the height in meters ) was 28.4 . The median AHI score at 12 months decreased 68 % , from 29.3 events per hour to 9.0 events per hour ( P < 0.001 ) ; the ODI score decreased 70 % , from 25.4 events per hour to 7.4 events per hour ( P < 0.001 ) . Secondary outcome measures showed a reduction in the effects of sleep apnea and improved quality of life . In the randomized phase , the mean AHI score did not differ significantly from the 12-month score in the nonrandomized phase among the 23 participants in the therapy-maintenance group ( 8.9 and 7.2 events per hour , respectively ) ; the AHI score was significantly higher ( indicating more severe apnea ) among the 23 participants in the therapy-withdrawal group ( 25.8 vs. 7.6 events per hour , P < 0.001 ) . The ODI results followed a similar pattern . The rate of procedure-related serious adverse events was less than 2 % .","In this uncontrolled cohort study , upper-airway stimulation led to significant improvements in objective and subjective measurements of the severity of obstructive sleep apnea . ( Funded by Inspire Medical Systems ; STAR ClinicalTrials.gov number , NCT01161420 . )"
"To identify facilitators and barriers to clinical trial implementation in Aboriginal health services .A fundamental enabler was that participants considered the research to be governed and endorsed by the local health service . That the research was perceived to address a health priority for communities was also highly motivating for both providers and patients . Enlisting the support of Aboriginal and Torres Strait Islander staff champions who were visible to the community as the main source of information about the trial was particularly important . The major implementation barrier for staff was balancing their service delivery roles with adherence to often highly demanding trial-related procedures . This was partially alleviated by the research team 's provision of onsite support and attempts to make trial processes more streamlined . Although more intensive support was highly desired , there were usually insufficient resources to provide this .","Despite strong community and health service support , major investments in time and resources are needed to ensure successful implementation and minimal disruption to already overstretched , routine services . Trial budgets will necessarily be inflated as a result . Funding agencies need to consider these additional resource demands when supporting trials of a similar nature ."
"To compare the effect of incomplete caries removal ( ICR ) and indirect pulp capping ( IPC ) with calcium hydroxide ( CH ) or an inert material ( wax ) on color , consistency and contamination of the remaining dentin of primary molars .No cases of yellow dentin were observed after 3 months with CH compared to 33.3 % of the wax cases ( P < 0.05 ) . A statistically significant difference over time was observed only for CH regarding consistency . CH stimulated a dentin hardening process in a statistically higher number of cases than wax ( 86.7 % vs. 33.3 % ; P = 0.008 ) . Contamination changed significantly over time in CH and wax without significant difference between groups . It was concluded that CH and wax arrested the carious process of the remaining carious dentin after indirect pulp capping , but CH showed superior dentin color and consistency after 3 months .",
"In literature there is a general consensus that the use of the mirror improves proprioception . During rehabilitation the mirror is an important instrument to improve stability . In some sports , such as dancing , mirrors are widely used during training . The purpose of this study is to evaluate the effectiveness of the use of a mirror on balance in young dancers . Sixty-four young dancers ( ranging from 9-10 years ) were included in this study . Thirty-two attending lessons with a mirror ( mirror - group ) were compared to 32 young dancers that attended the same lessons without a mirror ( non-mirror group ) . Balance was evaluated by BESS ( Balance Error Scoring System ) , which consists of three stances ( double limb , single limb , and tandem ) on two surfaces ( firm and foam ) . The errors were assessed at each stance and summed to create the two subtotal scores ( firm and foam surface ) and the final total score ( BESS ) . The BESS was performed at recruitment ( T0 ) and after 6months of dance lessons ( T1 ) .The repeated measures ANOVA analysis showed that for the BESS total score there is a difference due to the time ( F = 3.86 ; p < 0.05 ) . No other differences due to the group or to the time of measurement were found ( p > 0.05 ) . The analysis of the multiple regression model showed the influence of the values at T0 for every BESS items and the dominance of limb for stability on an unstable surface standing on one or two legs .","These preliminary results suggest that the use of a mirror in a ballet classroom does not improve balance acquisition of the dancer . On the other hand , improvement found after 6months confirms that at the age of the dancers studied motor skills and balance can easily be trained and improved ."
"Long-term follow-up studies documenting maintenance of treatment effects are fewin adolescent anorexia nervosa ( AN ) . This exploratory study reports relapse from full remission and attainment of remission during a 4-year open follow-up period using a convenience sample of a subgroup of 65 % ( n = 79 ) from an original cohort of 121 participants who completed a randomized clinical trial comparing family-based therapy ( FBT ) and adolescent-focused individual therapy ( AFT ) .Two participants ( 6.1 % ) relapsed ( FBT : n = 1 , 4.5 % ; AFT : n = 1 , 9.1 % ) , on average 1.98 years ( SD = 0.14 years ) after remission was achieved at 1-year follow-up . Ten new participants ( 22.7 % ) achieved remission ( FBT : n = 1 , 5.9 % ; AFT : n = 9 , 33.3 % ) . Mean time to remission for this group was 2.01 years ( SD = 0.82 years ) from 1-year follow-up . There were no differences based on treatment group assignment in either relapse from full remission or new remission during long-term follow-up . Other psychopathology was stable over time .",There were few changes in the clinical presentation of participants who were assessed at long-term follow-up . These data suggest that outcomes are generally stable posttreatment regardless of treatment type once remission is achieved . Clinical trial registration information-Effectiveness of Family-Based Versus Individual Psychotherapy in Treating Adolescents With Anorexia Nervosa ; http://www.clinicaltrials.gov/; NCT00149786 .
"Coronary artery bypass grafting using the radial artery has , since the 1990s , gone through a revival . Observational studies have indicated better long-term patency when using radial arteries . Therefore , radial artery might be preferred especially in younger patients where long time patency is important . During the last 10years different endoscopic techniques to harvest the radial artery have evolved . Endoscopic radial artery harvest only requires a small incision near the wrist in contrast to open harvest , which requires an incision from the elbow to the wrist . However , it is unknown whether the endoscopic technique results in fewer complications or a graft patency comparable to open harvest . When the radial artery has been harvested , there are two ways to use the radial artery as a graft . One way is sewing it onto the aorta and another is sewing it onto the mammary artery . It is unknown which technique is the superior revascularisation technique . ClinicalTrials.gov identifier : NCT01848886.Danish Ethics committee number : H-3-2012-116 . Danish Data Protection Agency : 2007-58-0015 / jr. n :30 -0838 .",
"Knowledge of essential amino acid requirements in infants is important because excessive intake of protein can lead to increased long-term morbidity such as obesity . A deficient intake may lead to suboptimal growth and impaired neurodevelopment . The current recommended branched-chain amino acid requirements in infants aged 0-1 mo are based on the amino acid content of human milk .We quantified the requirements for isoleucine , leucine , and valine for term neonates by using the indicator amino acid oxidation method with [ 1 - ( 13 ) C ] phenylalanine as the indicator .Eighty-three Asian , term neonates ( mean SD birth weight : 3.3 0.4 kg ; gestational age : 39.4 1.3 wk ) were studied at a postnatal age of 13 5 d. Mean requirements for isoleucine , leucine , and valine ( measured in boys only ) were 105 mg kg ( -1 ) d ( -1 ) ( r ( 2 ) = 0.61 , P < 0.001 ) , 140 mg kg ( -1 ) d ( -1 ) ( r ( 2 ) = 0.26 , P < 0.01 ) , and 110 mg kg ( -1 ) d ( -1 ) ( r ( 2 ) = 0.35 , P = 0.001 ) , respectively .","Current human milk-based recommendations for isoleucine and valine in term infants aged 0-1 mo are correct . However , the current recommendation for leucine ( 166 mg kg ( -1 ) d ( -1 ) ) is higher than the mean requirement of 140 mg kg ( -1 ) d ( -1 ) that we determined in this study . This trial was registered at www.trialregister.nl as NTR1610 ."
"We wanted to confirm the benefit of mometasone furoate ( MF ) in preventing acute radiation reactions , as shown in a previous study ( Bostrm et al , Radiother Oncol 2001 ; 59:257 -265 ) .Mean RTOG scores were significantly less for MF than for D ( P = .046 ) . Maximum RTOG and mean erythema scores were significantly less for MF than for D ( P = .018 and P = .012 , respectively ) . The Dermatology Life Quality Index ( DLQI ) score was significantly less for MF than for D at weeks 4 and 5 when corrected for Hospital Anxiety and Depression ( HAD ) questionnaire scores .","MF cream significantly reduces radiation dermatitis when applied to the breast during and after radiation therapy . For the first time , we have shown a significantly beneficial effect on quality of life using a validated instrument ( DLQI ) , for a topical steroid cream . We believe that application of this cream should be the standard of care where radiation dermatitis is expected ."
"To compare the interstage cardiac catheterization hemodynamic and angiographic findings between shunt types for the Pediatric Heart Network Single Ventricle Reconstruction trial . The trial , which randomized subjects to a modified Blalock-Taussig shunt ( MBTS ) or right ventricle-to-pulmonary artery shunt ( RVPAS ) for the Norwood procedure , demonstrated the RVPAS was associated with a smaller pulmonary artery diameter but superior 12-month transplant-free survival .Of 549 randomized subjects , 389 underwent pre-stage II catheterization . A smaller size , lower aortic and superior vena cava saturation , and higher ventricular end-diastolic pressure were associated with worse 12-month transplant-free survival . The MBTS group had a lower coronary perfusion pressure ( 27 vs 32 mm Hg ; P < .001 ) and greater pulmonary blood flow/systemic blood flow ratio ( 1.1 vs 1.0 , P = .009 ) . A greater pulmonary blood flow/systemic blood flow ratio increased the risk of death or transplantation only in the RVPAS group ( P = .01 ) . The MBTS group had fewer shunt ( 14 % vs 28 % , P = .004 ) and severe left pulmonary artery ( 0.7 % vs 9.2 % , P = .003 ) stenoses , larger mid-main branch pulmonary artery diameters , and greater Nakata indexes ( 164 vs 134 , P < .001 ) .","Compared with the RVPAS subjects , the MBTS subjects had more hemodynamic abnormalities related to shunt physiology , and the RVPAS subjects had more shunt or pulmonary obstruction of a severe degree and inferior pulmonary artery growth at pre-stage II catheterization . A lower body surface area , greater ventricular end-diastolic pressure , and lower superior vena cava saturation were associated with worse 12-month transplant-free survival ."
"It has been hypothesized that the development of diabetic polyneuropathy ( DPN ) is due to swelling of the nerve , as well as thickening and stiffening of the surrounding ligaments , causing chronic compression of nerves . We aimed to examine the effect of surgical decompression of the tibial nerve on the mean cross-sectional area ( CSA ) .CSA is significantly larger in patients with painful DPN ( 8.4 3.9 mm ( 2 ) ) than in control subjects ( 6.4 1.3 mm ( 2 ) ) , P = 0.007 . The T/W ratio in patients with painful DPN is 0.64 and in control subjects 0.59 , P = 0.03 . Patients with DPN have a significantly thicker retinaculum ( 1.07 mm ) than control subjects ( 0.84 mm ) , P < 0.001 . Mean follow-up was 28.2 weeks ( range 23-45 ) . Difference between baseline and follow-up in the operated leg was 1.49 mm ( 2 ) and in the control leg 1.81 mm ( 2 ) , P = 0.674 .","Decompression of the tibial nerve does not result in a significant difference between baseline and follow-up in CSA using ultrasound between the operated and control leg . Ultrasound measurements show a significantly increased CSA , a significantly thicker retinaculum , and a significantly increased T/W ratio in patients with painful DPN compared with healthy control subjects . Clinical trial reg . no . NTR2344 , www.trialregister.nl ."
